{
  "version": 2,
  "requestId": "fixture-v2-hls",
  "createdAt": "2026-07-20T00:00:00Z",
  "source": {"kind": "browser_capture", "url": "https://example.test/live", "title": "HLS", "platform": "generic"},
  "capture": {"method": "rendered_dom", "text": "hls body", "characterCount": 8, "completeness": "full_article", "capturedAt": "2026-07-20T00:00:00Z"},
  "evidence": {"sourceLabel": "Current page DOM", "usedCookie": false},
  "media": {"kind": "hls", "pageURL": "https://example.test/live", "canonicalURL": "https://example.test/live", "platform": "generic", "ephemeralPlaybackURL": "https://media.example.test/master.m3u8?fixture=redacted", "mimeType": "application/vnd.apple.mpegurl", "transcriptionCapability": "conditional", "candidateCount": 1, "selectionReason": "singleCandidate", "playbackState": "playing"}
}
